{
  "task": {
    "task_id": "paper-language-v0.1-proofreading",
    "objective": "Propose a reviewable English language candidate for the synthetic Markdown fixture in proofreading mode; preserve source and scientific meaning.",
    "task_type": "paper_language_review",
    "required_capabilities": [
      "paper_language"
    ],
    "complexity": "complex",
    "sensitivity": "public",
    "executor": "paper_language",
    "input_artifacts": [
      {
        "path": "paper-language-v0.1-fixture/manuscript.md",
        "sha256": "fa05039c73ebacae4d9f1d76d901521e00d78603ddf703ce91974bf2d45a4501",
        "schema_version": "1.0"
      },
      {
        "path": "paper-language-v0.1-fixture/terminology_glossary.yaml",
        "sha256": "b9984d7799e7ceb01ab603447cc27ab1085fb40d19a8a17333c568b20baad2a0",
        "schema_version": "1.0"
      }
    ],
    "output_artifacts": [
      "paper-language-v0.1-fixture/run-proofreading/language_report.md",
      "paper-language-v0.1-fixture/run-proofreading/language_changes.json",
      "paper-language-v0.1-fixture/run-proofreading/manuscript_edited.md"
    ],
    "status": "pending",
    "idempotency_key": null,
    "schema_version": "1.0"
  },
  "executor": "paper_language",
  "model": null,
  "attempt": 1,
  "schema_version": "1.0"
}
